id,event_type,latitude,longitude,endlatitude,endlongitude,address,end_address,event_cause,requires_road_closure,start_datetime,end_datetime,status,authenticated,modified_datetime,description,veh_type,corridor,priority,cargo_material,reason_breakdown,age_of_truck,created_date,client_id,police_station,resolved_at_address,resolved_at_latitude,resolved_at_longitude,closed_datetime,resolved_datetime,zone,junction,hour,day,month,day_of_week,weekend,duration_minutes,is_closed,is_resolved
FKID005646,planned,12.9694732,77.7006228,0.0,0.0,"Outer Ring Road, Karthik Nagar, Marathahalli, Bengaluru, Karnataka. Pin-560037 (India)",Unknown,construction,False,2024-01-03 21:02:56.581000+00:00,2024-01-04 09:05:46+00:00,closed,yes,2024-01-04 09:35:48.160284+00:00,[LOCATION] towards marathhalli and karthiknagara towards mahadevpura traffic movement will be slow due to metrostation work,Unknown,ORR East 2,High,None,Unknown,-1.0,2024-01-03 21:04:16.070129+00:00,1,HAL Old Airport,Unknown,12.9828467,77.58946,,,East Zone 1,Unknown,21.0,3.0,1.0,2.0,0,722.82365,0,0
FKID005652,planned,13.052805,77.6460686,13.0527775,77.6459637,"Hennur Main Road, K Narayanpura Cross, Kothnur Narayanapura, Bengaluru, Karnataka. Pin-560077 (India)","Hennur Main Road, K Narayanpura Cross, Kothnur Narayanapura, Bengaluru, Karnataka. Pin-560077 (India)",construction,True,2024-01-05 19:23:16.675000+00:00,2024-01-06 19:23:46+00:00,closed,yes,2024-01-06 19:35:47.898222+00:00,ಬಿಬಿಎಂಪಿ ವತಿಯಿಂದ white tapping ಕಾಮಗಾರಿ ಪ್ರಗತಿಯಲ್ಲಿದೆ..,Unknown,Non-corridor,Low,None,Unknown,-1.0,2024-01-05 19:25:08.614700+00:00,1,Hennuru,Unknown,12.9828467,77.58946,,,East Zone 2,Unknown,19.0,5.0,1.0,4.0,0,1440.48875,0,0
FKID005672,planned,12.99839542,77.66370535,13.01290305,77.6624769,"Benniganahalli Flyover, ೧ನೇ ಅಡ್ಡ ರಸ್ತೆ, ಬೆನ್ನಿಗಾನಹಳ್ಳಿ, ಬೈಯಪ್ಪನಹಳ್ಳಿ, ಕೃಷ್ಣಯ್ಯನ ಪಾಳ್ಯ, ಬೆಂಗಳೂರು ಮಧ್ಯ ನಗರ ನಿಗಮ, Bengaluru, ಬೆಂಗಳೂರು ಪೂರ್ವ, ಬೆಂಗಳೂರು ನಗರ, Karnataka, 560033, India","Service Road, ದೂರವಾಣಿನಗರ, ಬೆಂಗಳೂರು ಪೂರ್ವ ನಗರ ನಿಗಮ, Bengaluru, ಬೆಂಗಳೂರು ಪೂರ್ವ, ಬೆಂಗಳೂರು ನಗರ, Karnataka, 560043, India",construction,True,,2024-01-29 11:35:46+00:00,closed,yes,2024-01-29 11:35:46.026380+00:00,"Railway Department's work of pouring concrete on iron plates at [LOCATION] ring road near [LOCATION] pass(13.0034039, [PHONE])",Unknown,ORR North 1,High,None,Unknown,-1.0,2024-01-19 03:44:54.008319+00:00,1,Banaswadi,Unknown,12.9828467,77.58946,,,East Zone 2,Unknown,,,,,0,325.0827,0,0
FKID005732,planned,13.0616022,77.4608672,0.0,0.0,"Mumbai Bengaluru Highway, Nadaprabhu Kempegowda Circle, Madanaiyakanahalli, Bengaluru, Karnataka. Pin-562162 (India)",Unknown,construction,False,2024-01-17 10:41:24.595000+00:00,2024-01-17 01:41:46+00:00,closed,yes,2024-01-17 11:35:48.027782+00:00,Slow moving traffic towards city main track madavar,Unknown,Non-corridor,Low,None,Unknown,-1.0,2024-01-17 10:43:00.933631+00:00,1,No Police Station,Unknown,12.9828467,77.58946,,,Unknown,Unknown,10.0,17.0,1.0,2.0,0,-539.64325,0,0
FKID005734,planned,13.0924121,77.5592793,0.0,0.0,"6th Main Road, Giridhama Nagar, Doddabettahalli, Bengaluru, Karnataka. Pin-560097 (India)",Unknown,construction,False,2024-01-17 12:21:14.158000+00:00,2024-01-17 17:10:46+00:00,closed,yes,2024-01-17 17:35:47.789693+00:00,Drainage Road work at GKVK back gate sir,Unknown,Non-corridor,Low,None,Unknown,-1.0,2024-01-17 12:22:48.154764+00:00,1,Yelahanka,Unknown,12.9828467,77.58946,,,North Zone 2,Unknown,12.0,17.0,1.0,2.0,0,289.5307,0,0
FKID005741,planned,12.9694711,77.7006261,0.0,0.0,"Outer Ring Road, Karthik Nagar, Marathahalli, Bengaluru, Karnataka. Pin-560037 (India)",Unknown,construction,False,2024-01-17 21:02:55.218000+00:00,2024-01-18 09:05:46+00:00,closed,yes,2024-01-18 09:35:47.953843+00:00,[LOCATION] towards [LOCATION] and karthiknagara towards marathhalli traffic movement will be slow due to metrostation work,Unknown,ORR East 2,High,None,Unknown,-1.0,2024-01-17 21:03:49.038547+00:00,1,HAL Old Airport,Unknown,12.9828467,77.58946,,,East Zone 1,Unknown,21.0,17.0,1.0,2.0,0,722.8463666666667,0,0
FKID005746,planned,13.04974,77.5536767,0.0,0.0,"Rajatha Bhavana Road, Dr K Shivaramakarantha Circle, Jalahalli, Bengaluru, Karnataka. Pin-560013 (India)",Unknown,construction,False,,2024-01-18 12:05:46+00:00,closed,yes,2024-01-18 12:35:47.898148+00:00,White topping work progress,Unknown,Non-corridor,Low,None,Unknown,-1.0,2024-01-18 05:01:48.657121+00:00,1,Jalahalli,Unknown,12.9828467,77.58946,,,North Zone 2,Unknown,,,,,0,325.0827,0,0
FKID005749,planned,12.9354212,77.7057568,0.0,0.0,"Panathur Main Road, Panathur, Bengaluru, Karnataka. Pin-560087 (India)",Unknown,construction,False,2024-01-18 02:13:27.433000+00:00,2024-01-18 10:05:46+00:00,closed,yes,2024-01-18 10:35:48.137979+00:00,[LOCATION] railway bridge junction sir,Unknown,Non-corridor,Low,None,Unknown,-1.0,2024-01-18 02:15:02.728107+00:00,1,HAL Old Airport,Unknown,12.9828467,77.58946,,,East Zone 1,Unknown,2.0,18.0,1.0,3.0,0,472.30944999999997,0,0
FKID005750,planned,12.9355397,77.7059347,0.0,0.0,"Panathur Main Road, Vandana Tejyesh, Varthur Hobli, Panathur, Bengaluru, Karnataka. Pin-560087 (India)",Unknown,construction,False,2024-01-18 19:30:19.427000+00:00,2024-01-19 02:05:46+00:00,closed,yes,2024-01-19 02:35:47.877985+00:00,White topping work panatur railway bridge towards kadubesanahalli.,Unknown,Non-corridor,Low,None,Unknown,-1.0,2024-01-18 19:31:58.134057+00:00,1,HAL Old Airport,Unknown,12.9828467,77.58946,,,East Zone 1,Unknown,19.0,18.0,1.0,3.0,0,395.4428833333333,0,0
FKID005753,planned,12.9685753,77.7011831,0.0,0.0,"Outer Ring Road, Karthik Nagar, Marathahalli, Bengaluru, Karnataka. Pin-560037 (India)",Unknown,construction,False,,2024-01-19 09:05:46+00:00,closed,yes,2024-01-19 09:35:48.256009+00:00,[LOCATION] towards marathhalli and karthiknagara towards mahadevpura traffic movement will be slow due to metrostation work,Unknown,ORR East 2,High,None,Unknown,-1.0,2024-01-18 21:22:56.634927+00:00,1,HAL Old Airport,Unknown,12.9828467,77.58946,,,East Zone 1,Unknown,,,,,0,325.0827,0,0
FKID005754,planned,12.9921852,77.5833688,0.0,0.0,"Kumar Krupa Road, State Government Quarter, Kumara Park East, Seshadripuram, Bengaluru, Karnataka. Pin-560001 (India)",Unknown,public_event,False,,2024-01-18 17:30:46+00:00,closed,yes,2024-01-18 23:35:48.006335+00:00,Due to event at [LOCATION]kk road traffic  slowly moving,Unknown,Bellary Road 1,High,None,Unknown,-1.0,2024-01-18 22:41:38.604123+00:00,1,High ground,Unknown,12.9828467,77.58946,,,Central Zone 2,Unknown,,,,,0,325.0827,0,0
FKID005805,planned,12.91747438,77.57394791,12.90644027,77.57317543,"Banashankari TTMC, ಮಾರೇನಹಳ್ಳಿ ರಸ್ತೆ, ಶಾಕಂಭರಿನಗರ, ಬೆಂಗಳೂರು ದಕ್ಷಿಣ ನಗರ ನಿಗಮ, Bengaluru, ಬೆಂಗಳೂರು ದಕ್ಷಿಣ, ಬೆಂಗಳೂರು ನಗರ, Karnataka, 560070, India","Sarakki Junction, ಹೊರ ವರ್ತುಲ ರಸ್ತೆ, ಬನಶಂಕರಿ ದೇವಸ್ಥಾನ ವಾರ್ಡ್, ಬೆಂಗಳೂರು ದಕ್ಷಿಣ ನಗರ ನಿಗಮ, Bengaluru, ಬೆಂಗಳೂರು ದಕ್ಷಿಣ, ಬೆಂಗಳೂರು ನಗರ, Karnataka, 560078, India",public_event,True,,2023-11-12 05:05:46+00:00,closed,yes,2023-11-12 05:05:46.016401+00:00,[PERSON] Ammanavara Brahma Rathotsava,Unknown,Non-corridor,Low,None,Unknown,-1.0,2023-11-11 00:22:34.048583+00:00,1,Jayanagara,Unknown,12.9828467,77.58946,,,South Zone 1,BanashankariBusStandJunc,,,,,0,325.0827,0,0
FKID005806,planned,12.91747438,77.57394791,12.90644027,77.57317543,"Banashankari TTMC, ಮಾರೇನಹಳ್ಳಿ ರಸ್ತೆ, ಶಾಕಂಭರಿನಗರ, ಬೆಂಗಳೂರು ದಕ್ಷಿಣ ನಗರ ನಿಗಮ, Bengaluru, ಬೆಂಗಳೂರು ದಕ್ಷಿಣ, ಬೆಂಗಳೂರು ನಗರ, Karnataka, 560070, India","Sarakki Junction, ಹೊರ ವರ್ತುಲ ರಸ್ತೆ, ಬನಶಂಕರಿ ದೇವಸ್ಥಾನ ವಾರ್ಡ್, ಬೆಂಗಳೂರು ದಕ್ಷಿಣ ನಗರ ನಿಗಮ, Bengaluru, ಬೆಂಗಳೂರು ದಕ್ಷಿಣ, ಬೆಂಗಳೂರು ನಗರ, Karnataka, 560078, India",public_event,True,,2023-11-12 05:05:46+00:00,closed,yes,2023-11-12 05:05:46.016412+00:00,[PERSON] Ammanavara Brahma Rathotsava,Unknown,Non-corridor,Low,None,Unknown,-1.0,2023-11-11 00:22:35.438556+00:00,1,Jayanagara,Unknown,12.9828467,77.58946,,,South Zone 1,BanashankariBusStandJunc,,,,,0,325.0827,0,0
FKID005833,planned,12.9817242,77.5700018,12.9817242,77.5700018,"Railway Road, Platform Road Junction, Sevashrama, Bengaluru, Karnataka. Pin-560023 (India)","Railway Road, Platform Road Junction, Sevashrama, Bengaluru, Karnataka. Pin-560023 (India)",construction,True,,2023-11-12 10:05:46+00:00,closed,yes,2023-11-12 08:59:58.579389+00:00,ಸರ್ PF ಜಂಕ್ಷನ್ ಕಡೆಯಿಂದ KFM ಜಂಕ್ಷನ್ ಕಡೆಗೆ ವೈಟ್ TOPPING ಕೆಲಸದ ನಿಮಿತ್ತ ರಸ್ತೆ ಬಂದ್ ಮಾಡಿರುತ್ತಾರೆ.,Unknown,Non-corridor,Low,None,Unknown,-1.0,2023-11-11 22:03:51.780759+00:00,1,Sheshadripuram,Unknown,12.9828467,77.58946,2023-11-12 08:59:58.578889+00:00,,Central Zone 2,PlatformRdJunction,,,,,0,325.0827,1,0
FKID005836,planned,13.0427611,77.6103677,0.0,0.0,"MBT Road, SNN Clermont, Hebbal Kempapura, Bengaluru, Karnataka. Pin-560024 (India)",Unknown,construction,False,2023-11-12 00:21:45.465000+00:00,2023-11-12 05:22:46+00:00,closed,yes,2023-11-12 05:35:47.810746+00:00,BWSSB work in process near SNN apartment towards  [LOCATION] slow moving traffic,Unknown,ORR North 1,High,None,Unknown,-1.0,2023-11-12 00:23:23.746525+00:00,1,Hebbala,Unknown,12.9828467,77.58946,,,North Zone 1,"VeerannapalyaJunction(BEL,HO)",0.0,12.0,11.0,6.0,1,301.00891666666666,0,0
FKID005837,planned,13.0426969,77.6103967,0.0,0.0,"MBT Road, SNN Clermont, Hebbal Kempapura, Bengaluru, Karnataka. Pin-560024 (India)",Unknown,construction,False,2023-11-12 00:57:28.944000+00:00,2023-11-12 02:05:46+00:00,closed,yes,2023-11-12 02:35:48.029288+00:00,[LOCATION] work at veeranapally down ramp towards hebbal sir,Unknown,ORR North 1,High,None,Unknown,-1.0,2023-11-12 00:59:17.899120+00:00,1,Hebbala,Unknown,12.9828467,77.58946,,,North Zone 1,"VeerannapalyaJunction(BEL,HO)",0.0,12.0,11.0,6.0,1,68.28426666666665,0,0
FKID005875,planned,13.0416928,77.6118382,13.0416996,77.6117695,"Kankanagar Main Road, Lawrence Layout, Nagavara, Bengaluru, Karnataka. Pin-560045 (India)","Kankanagar Main Road, Lawrence Layout, Nagavara, Bengaluru, Karnataka. Pin-560045 (India)",construction,True,2023-11-13 23:13:26.598000+00:00,2023-11-14 06:36:46+00:00,closed,yes,2023-11-14 07:35:48.010782+00:00,Road closed due to BWSSB work,Unknown,ORR North 1,High,None,Unknown,-1.0,2023-11-13 23:15:19.121677+00:00,1,K.G. Halli,Unknown,12.9828467,77.58946,,,North Zone 1,"VeerannapalyaJunction(BEL,HO)",23.0,13.0,11.0,0.0,0,443.32336666666663,0,0
FKID005877,planned,12.9534302,77.5911341,12.9538635,77.5912988,"KH Road, Wilson Garden, Bengaluru, Karnataka. Pin-560027 (India)","Sri Kolada Mata Road, Wilson Garden, Bengaluru, Karnataka. Pin-560027 (India)",construction,True,2023-11-13 23:59:16.944000+00:00,2023-11-14 11:01:46+00:00,closed,yes,2023-11-14 11:35:48.279949+00:00,[LOCATION] work progress vehicals slow movement,Unknown,Non-corridor,Low,None,Unknown,-1.0,2023-11-14 00:02:42.557361+00:00,1,Wilson Garden,Unknown,12.9828467,77.58946,,,Central Zone 2,K H Road-SiddaiahRdJunc(BMTC-BigBazaar),23.0,13.0,11.0,0.0,0,662.4842666666666,0,0
FKID005948,planned,13.0416919,77.6118446,13.0416782,77.6118482,"Kankanagar Main Road, Lawrence Layout, Nagavara, Bengaluru, Karnataka. Pin-560045 (India)","Kankanagar Main Road, Lawrence Layout, Nagavara, Bengaluru, Karnataka. Pin-560045 (India)",construction,True,2023-11-15 23:50:33.280000+00:00,2023-11-16 06:30:46+00:00,closed,yes,2023-11-16 06:35:48.095851+00:00,BWSSB WORK IS GOINGON near [LOCATION] service road towards [LOCATION] service road Connecting road is closed,Unknown,ORR North 1,High,None,Unknown,-1.0,2023-11-15 23:52:40.699286+00:00,1,K.G. Halli,Unknown,12.9828467,77.58946,,,North Zone 1,"VeerannapalyaJunction(BEL,HO)",23.0,15.0,11.0,2.0,0,400.21200000000005,0,0
FKID005979,planned,12.958055,77.668315,0.0,0.0,"Suranjan Das Road, HAL Circle, Airport Area, Bengaluru, Karnataka. Pin-560017 (India)",Unknown,vehicle_breakdown,False,2023-11-16 20:36:55.601000+00:00,2023-11-16 20:42:46+00:00,closed,yes,2023-11-16 21:35:47.829665+00:00,18977,others,Old Airport Road,High,None,Unknown,-1.0,2023-11-16 20:44:10.936144+00:00,1,HAL Old Airport,Unknown,12.9828467,77.58946,,,East Zone 2,"KuvempuCircleJunc,HAL MainGate",20.0,16.0,11.0,3.0,0,5.8399833333333335,0,0
FKID006030,planned,12.98270768,77.57672935,12.98072108,77.57686888,"Race Course Road, Madhav Nagar, High Grounds, Sampangirama Nagar, Bengaluru Central City Corporation, Bengaluru, Bangalore North, Bengaluru Urban, Karnataka, 560001, India","R Subbanna Circle, Sheshadri Road, Gandhinagar, Nehru Nagar, Bengaluru Central City Corporation, Bengaluru, Bangalore North, Bengaluru Urban, Karnataka, 560009, India",construction,True,,2024-01-19 11:35:46+00:00,closed,yes,2024-01-19 11:35:47.863115+00:00,White Topping Phase 1 at [LOCATION],Unknown,Non-corridor,Low,None,Unknown,-1.0,2023-11-18 05:26:39.640245+00:00,1,High ground,Unknown,12.9828467,77.58946,,,Central Zone 2,SubbannaJunction,,,,,0,325.0827,0,0
FKID006037,planned,12.9633032,77.5807995,12.963339,77.5808742,"Narasimha Raj Wadiyar Road, Potters Colony, Kalasipalyam, Bengaluru, Karnataka. Pin-560002 (India)","Narasimha Raj Wadiyar Road, Potters Colony, Kalasipalyam, Bengaluru, Karnataka. Pin-560002 (India)",construction,True,2023-11-18 11:30:46.482000+00:00,2023-11-17 13:10:46+00:00,closed,no,2023-11-18 11:35:48.152965+00:00,Construction,Unknown,Mysore Road,High,None,Unknown,-1.0,2023-11-18 11:33:07.878990+00:00,1,City Market,Unknown,12.9828467,77.58946,,,Central Zone 2,ShivajiTalkiesJunc,11.0,18.0,11.0,5.0,1,-1340.0080333333333,0,0
FKID006074,planned,12.9164396,77.6113131,0.0,0.0,"Outer Ring Road, MHBCS Layout, BTM Layout Stage 1, Bengaluru, Karnataka. Pin-560029 (India)",Unknown,construction,False,2023-11-19 22:50:31.590000+00:00,2023-11-19 12:05:46+00:00,closed,yes,2023-11-19 23:35:47.722138+00:00,BWSSB WORK  IN PROGRESS,Unknown,Non-corridor,Low,None,Unknown,-1.0,2023-11-19 22:53:11.574178+00:00,1,Mico Layout,Unknown,12.9828467,77.58946,,,South Zone 2,BTM16thMain-ORR Junc,22.0,19.0,11.0,6.0,1,-644.7598333333333,0,0
FKID006091,planned,13.0401786,77.624334,0.0,0.0,"MBT Road, Nagawara Junction, HBR Layout, Bengaluru, Karnataka. Pin-560043 (India)",Unknown,construction,False,2023-11-20 19:32:14.524000+00:00,2023-11-20 23:11:46+00:00,closed,yes,2023-11-20 23:35:47.963693+00:00,ಮೆಟ್ರೋ ವರ್ಕ್ ಸ್ಲೋ ಮೂವ್ಮೆಂಟ್ sir,Unknown,Hennur Main Road,High,None,Unknown,-1.0,2023-11-20 20:12:04.817669+00:00,1,Hennuru,Unknown,12.9828467,77.58946,,,North Zone 1,Nagavara-ORR Junction,19.0,20.0,11.0,0.0,0,219.52460000000002,0,0
FKID006105,planned,13.0232061,77.5333363,0.0,0.0,"Dr Rajkumar Puniya Bhoomi Road, FTI Junction, Nandini Layout, Bengaluru, Karnataka. Pin-560096 (India)",Unknown,public_event,False,2023-11-21 00:02:11.923000+00:00,2023-11-20 13:02:46+00:00,closed,yes,2023-11-21 00:35:47.999895+00:00,Unknown,Unknown,Non-corridor,Low,None,Unknown,-1.0,2023-11-21 00:01:43.681249+00:00,1,Yeshwanthpura,Unknown,12.9828467,77.58946,,,West Zone 1,FTI Junction(KanteeravaStudio),0.0,21.0,11.0,1.0,0,-659.43205,0,0
FKID006118,planned,12.9178592,77.6231754,12.9178592,77.6231754,"Silk Board Double Decker Flyover, Silk Board Junction, HSR Layout, Bengaluru, Karnataka. Pin-560102 (India)","Silk Board Double Decker Flyover, Silk Board Junction, HSR Layout, Bengaluru, Karnataka. Pin-560102 (India)",construction,True,2023-11-21 08:23:00.469000+00:00,2023-11-21 08:27:46+00:00,closed,yes,2023-11-21 08:35:47.804523+00:00,ಸರ್ ನಮಸ್ತೆ ಸಿಲ್ಕ್ ಬೋರ್ಡ್ ಸಿಗ್ನಲ್ ನಲ್ಲಿ ಮೆಟ್ರೋ ಕಾಮಗಾರಿ ನಡೆಯುತ್ತಿರುವುದರಿಂದ ಮೆಟ್ರೋ ಕಡೆಯಿಂದ ರೋಡ್ ಕ್ಲೋಸ್ ಮಾಡಿರುತ್ತಾರೆ ಸರ್ ಟ್ರಾಫಿಕ್ slow ಮೂಮೆಂಟ್ ಇದೆ  sir,Unknown,ORR East 1,High,None,Unknown,-1.0,2023-11-21 08:28:08.456631+00:00,1,Madiwala,Unknown,12.9828467,77.58946,,,South Zone 2,SilkBoardJunc,8.0,21.0,11.0,1.0,0,4.75885,0,0
FKID006194,planned,12.9690897,77.5872201,0.0,0.0,"Nrupatunga Road, Police Corner Junction, Nagartapete, Bengaluru, Karnataka. Pin-560002 (India)",Unknown,construction,False,2023-11-24 08:00:55.130000+00:00,2023-11-24 08:03:46+00:00,closed,yes,2023-11-24 08:35:47.930162+00:00,HC11752,Unknown,Mysore Road,High,None,Unknown,-1.0,2023-11-24 08:04:27.939602+00:00,1,Halasuru Gate,Unknown,12.9828467,77.58946,,,Central Zone 2,PoliceCornerJunc,8.0,24.0,11.0,4.0,0,2.8478333333333334,0,0
FKID006207,planned,12.99819784,77.55306959,12.98356836,77.56026328,"ನವರಂಗ್ ಜಂಕ್ಷನ್, ಡಾ|| ರಾಜ್-ಕುಮಾರ್ ರಸ್ತೆ, ಗಾಯತ್ರಿನಗರ, ಗಾಯತ್ರಿ ನಗರ, ಬೆಂಗಳೂರು ಪಶ್ಚಿಮ ನಗರ ನಿಗಮ, Bengaluru, ಬೆಂಗಳೂರು ಉತ್ತರ, ಬೆಂಗಳೂರು ನಗರ, Karnataka, 560021, India","SJRC Circle, ರಾಜ್ಕುಮಾರ್ ರಸ್ತೆ, ರಾಜಜಿನಗರ ೪ನೇ ಬ್ಲಾಕ್, ದ.ರಾ.ಬೇಂದ್ರೆ ವಾರ್ಡ್, ಬೆಂಗಳೂರು ಪಶ್ಚಿಮ ನಗರ ನಿಗಮ, Bengaluru, ಬೆಂಗಳೂರು ಉತ್ತರ, ಬೆಂಗಳೂರು ನಗರ, Karnataka, 560010, India",construction,True,,2024-05-07 12:05:46+00:00,active,yes,2023-11-27 12:26:16.648639+00:00,White Topping work at Dr. [PERSON].,Unknown,West of Chord Road,High,None,Unknown,-1.0,2023-11-25 04:13:38.140034+00:00,1,Rajajinagar,Unknown,12.9828467,77.58946,,,West Zone 1,NavarangTheatreJunction,,,,,0,325.0827,0,0
FKID006210,planned,12.90572474,77.54278064,12.89876594,77.54393399,"ಕೋಣನಕುಂಟೆ ಉತ್ತರಹಳ್ಳಿ ರಸ್ತೆ, Vasanthapura, ಉತ್ತರಹಳ್ಳಿ, ಬೆಂಗಳೂರು ದಕ್ಷಿಣ ನಗರ ನಿಗಮ, Bengaluru, ಬೆಂಗಳೂರು ದಕ್ಷಿಣ, ಬೆಂಗಳೂರು ನಗರ, Karnataka, 560061, India","ಕೋಣನಕುಂಟೆ ಉತ್ತರಹಳ್ಳಿ ರಸ್ತೆ, Vasanthapura, ಉತ್ತರಹಳ್ಳಿ, ಬೆಂಗಳೂರು ದಕ್ಷಿಣ ನಗರ ನಿಗಮ, Bengaluru, ಬೆಂಗಳೂರು ದಕ್ಷಿಣ, ಬೆಂಗಳೂರು ನಗರ, Karnataka, 560061, India",construction,True,,2023-12-03 10:05:46+00:00,closed,yes,2023-12-03 10:05:46.022456+00:00,"[PERSON]
at [LOCATION].",Unknown,Non-corridor,Low,None,Unknown,-1.0,2023-11-25 04:27:14.312322+00:00,1,K.S. Layout,Unknown,12.9828467,77.58946,,,South Zone 1,UttarahalliJunction,,,,,0,325.0827,0,0
FKID006248,planned,13.1463017,77.6183496,0.0,0.0,"Bengaluru Bellary Road, Farah Seven, Sri Rajarajeshwari Nagar, Hunasamaranahalli, Bengaluru, Karnataka. Pin-562157 (India)",Unknown,public_event,False,2023-11-27 06:25:47.912000+00:00,2023-11-27 09:35:46+00:00,closed,yes,2023-11-27 09:35:47.960662+00:00,Unknown,Unknown,Bellary Road 2,High,None,Unknown,-1.0,2023-11-27 06:28:05.625332+00:00,1,Chikkajala,Unknown,12.9828467,77.58946,,,Unknown,HunsemarammanahalliJunction,6.0,27.0,11.0,0.0,0,189.96813333333333,0,0
FKID006283,planned,12.95236447,77.60536618,12.93429414,77.61249264,"Anepalya, Hosur Road, Vinayakanagar, Bengaluru Central City Corporation, Bengaluru, Bangalore North, Bengaluru Urban, Karnataka, 560047, India","Hosur Road, Kormangala West, Bengaluru South City Corporation, Bengaluru, Bangalore South, Bengaluru Urban, Karnataka, 560095, India",public_event,True,,2023-12-04 22:05:46+00:00,closed,yes,2023-12-04 22:05:46.042235+00:00,Hosur - Lushkar Road Rathasapthami,Unknown,Hosur Road,High,None,Unknown,-1.0,2023-11-28 05:37:25.696835+00:00,1,Ashok Nagar,Unknown,12.9828467,77.58946,,,Central Zone 1,AnepalyaJunc,,,,,0,325.0827,0,0
FKID006314,planned,12.96781849,77.58867461,12.98090498,77.59713535,"Kasturba Road, Cubbonpet, Sampangirama Nagar, Bengaluru Central City Corporation, Bengaluru, Bangalore North, Bengaluru Urban, Karnataka, 560002, India","Minsk Square, Queen's Road, Sampangirama Nagar, Bengaluru Central City Corporation, Bengaluru, Bangalore North, Bengaluru Urban, Karnataka, 560001, India",procession,True,,2024-01-07 22:05:46+00:00,closed,yes,2024-01-07 20:35:47.864394+00:00,Police Marathon 2026,Unknown,Mysore Road,High,None,Unknown,-1.0,2023-11-29 06:02:48.238526+00:00,1,Halasuru Gate,Unknown,12.9828467,77.58946,,,Central Zone 2,HudsonCircle,,,,,0,325.0827,0,0
FKID006315,planned,12.9760586,77.58741676,12.98185117,77.59451266,"KR Circle, Old Post Office Road, Sampangirama Nagar, Bengaluru Central City Corporation, Bengaluru, Bangalore North, Bengaluru Urban, Karnataka, 560001, India","Police Thimmaya Circle, Doctor B R Ambedkar Veedhi, Sampangirama Nagar, Bengaluru Central City Corporation, Bengaluru, Bangalore North, Bengaluru Urban, Karnataka, 560001, India",procession,True,,2024-01-07 22:05:46+00:00,closed,yes,2024-01-07 20:35:47.889103+00:00,Police Marathon 2026,Unknown,Non-corridor,Low,None,Unknown,-1.0,2023-11-29 06:06:13.717042+00:00,1,Cubbon Park,Unknown,12.9828467,77.58946,,,Central Zone 2,K R Circle,,,,,0,325.0827,0,0
FKID006376,planned,13.0469855,77.5915374,0.0,0.0,"Bellary Road, Esteem Mall, Hebbal Kempapura, Bengaluru, Karnataka. Pin-560024 (India)",Unknown,construction,False,2023-11-30 22:41:19.796000+00:00,2023-11-30 12:40:46+00:00,closed,yes,2023-11-30 23:35:47.730846+00:00,Nhi road cleaning work sir tw airport Hebbal down ramp,Unknown,Bellary Road 1,High,None,Unknown,-1.0,2023-11-30 22:42:51.949560+00:00,1,Kodigehalli,Unknown,12.9828467,77.58946,,,North Zone 1,HebbalFlyoverJunc,22.0,30.0,11.0,3.0,0,-600.5632666666667,0,0
FKID006401,planned,12.96067984,77.6415265,12.97301671,77.64707062,"Old Airport Road, Carlton Towers, HAL Stage 2, Indiranagar, Bengaluru, Karnataka. Pin-560008 (India)","Sir CV Raman Hospital Road, Colony 515, New Thippasandra, Bengaluru, Karnataka. Pin-560075 (India)",public_event,True,2023-12-01 21:01:00.395000+00:00,2023-12-01 12:05:46+00:00,closed,yes,2023-12-01 21:35:47.846159+00:00,Regarding of Lim-01 movement there will be a traffic congestion..so that take alternative routs kindly co-operate,Unknown,Old Airport Road,High,None,Unknown,-1.0,2023-12-01 21:03:51.246563+00:00,1,Halasur,Unknown,12.9828467,77.58946,,,Central Zone 1,DomlurWaterTank,21.0,1.0,12.0,4.0,0,-535.2399166666667,0,0
FKID006434,planned,12.9738007,77.6128385,0.0,0.0,"Mahatma Gandhi Road, Prestige Meridian, Ashok Nagar, Bengaluru, Karnataka. Pin-560001 (India)",Unknown,construction,False,2023-12-02 22:34:12.203000+00:00,2023-12-09 22:37:46+00:00,closed,yes,2023-12-03 01:04:04.458384+00:00,[LOCATION] work progressing,Unknown,Old Madras Road,High,None,Unknown,-1.0,2023-12-02 22:37:56.858036+00:00,1,Ashok Nagar,Unknown,12.9828467,77.58946,2023-12-03 01:04:04.457870+00:00,,Central Zone 1,WebbsCircle,22.0,2.0,12.0,5.0,1,10083.563283333333,1,0
FKID006440,planned,13.009805,77.5060113,0.0,0.0,"Handrihalli Main Road, M Ramaiah Layout, Stage 2, Peenya, Bengaluru, Karnataka. Pin-560058 (India)",Unknown,construction,False,2023-12-03 00:33:29.621000+00:00,2023-12-05 00:36:46+00:00,closed,yes,2023-12-05 01:35:47.589424+00:00,Unknown,Unknown,Non-corridor,Low,None,Unknown,-1.0,2023-12-03 00:37:21.278689+00:00,1,Peenya,Unknown,12.9828467,77.58946,,,West Zone 1,Peenya2ndStageBusStand,0.0,3.0,12.0,6.0,1,2883.2729833333333,0,0
FKID006473,planned,13.0661392,77.5930153,13.0652808,77.5927897,"RK Road Number 7, Park View Layout, Byatarayanapura, Bengaluru, Karnataka. Pin-560092 (India)","5th Cross Road, Park View Layout, Byatarayanapura, Bengaluru, Karnataka. Pin-560092 (India)",procession,True,2023-12-04 04:34:08.961000+00:00,2023-12-04 06:34:46+00:00,closed,yes,2023-12-04 06:35:47.896959+00:00,[PERSON] ರವರ ನೇತೃತ್ವದಲ್ಲಿ ಸುಮಾರು 300 ಜನ ಪ್ರೋಸೆಷನ್ ಮಾಡುತ್ತಿದ್ದಾರೆ ಬ್ಯಾಟರಾಯನಪುರ ಹತ್ತಿರ ಏರ್ಪೋರ್ಟ್ ಕಡೆಗೆ ಸರ್ವಿಸ್ ರಸ್ತೆಯನ್ನು ಕ್ಲೋಸ್ ಮಾಡಿ ರುತ್ತೇವೆ ಸಂಚಾರಕ್ಕೆ ಯಾವುದೇ ತೊಂದರೆ ಆಗದಂತೆ ಮೇನ್ ರೋಡಿಗೆ ಡ್ರೈ ವರ್ಷನ್ ಮಾಡುತ್ತಿದ್ದೇವೆ ಸಂಚಾರಕ್ಕೆ ಯಾವುದೇ ತೊಂದರೆ ಇರುವುದಿಲ್ಲ sir,Unknown,Bellary Road 2,High,None,Unknown,-1.0,2023-12-04 04:38:36.216273+00:00,1,Kodigehalli,Unknown,12.9828467,77.58946,,,North Zone 1,Batrayanapura(Amrutahalli)Junction,4.0,4.0,12.0,0.0,0,120.61731666666667,0,0
